{
  "algorithm": "deterministic-lexical-index-v1",
  "exclusions": {},
  "file_count": 4,
  "files": [
    {
      "content_indexed": true,
      "language": "text",
      "line_count": 6,
      "path": "LICENSE",
      "sha256": "sha256:6ca11eaea7768ac1f65a8d5fcba2c5135dac62c4bac805eae004a70090d5b831",
      "size_bytes": 197,
      "symbol_limit_reached": false,
      "symbols": [],
      "token_limit_reached": false,
      "tokens": {
        "ai": 1,
        "apache": 2,
        "contains": 1,
        "content": 1,
        "copyright": 1,
        "customer": 1,
        "fixture": 1,
        "identifier": 1,
        "is": 1,
        "it": 1,
        "license": 3,
        "licensed": 1,
        "no": 1,
        "or": 1,
        "party": 1,
        "repository": 1,
        "skylark": 1,
        "spdx": 1,
        "synthetic": 1,
        "the": 1,
        "third": 1,
        "this": 1,
        "under": 1,
        "version": 1
      }
    },
    {
      "content_indexed": true,
      "language": "text",
      "line_count": 5,
      "path": "README.md",
      "sha256": "sha256:c06edd7927e50fb19e46dab781868e7d9740d543d608242b0d4ac4b3bc58f413",
      "size_bytes": 221,
      "symbol_limit_reached": false,
      "symbols": [],
      "token_limit_reached": false,
      "tokens": {
        "an": 1,
        "and": 1,
        "archive": 2,
        "authored": 1,
        "containment": 1,
        "deliberately": 1,
        "exercise": 1,
        "exists": 1,
        "fixture": 2,
        "it": 1,
        "joins": 1,
        "local": 1,
        "lumi": 1,
        "md": 1,
        "member": 1,
        "only": 1,
        "pipeline": 1,
        "readme": 1,
        "reproduction": 1,
        "retrieval": 1,
        "skylark": 1,
        "synthetic": 1,
        "this": 1,
        "to": 1,
        "trace": 1,
        "untrusted": 1,
        "validation": 1,
        "without": 1
      }
    },
    {
      "content_indexed": true,
      "language": "shell",
      "line_count": 8,
      "path": "src/archive.sh",
      "sha256": "sha256:9f6bb2c8011679a4319daf90bf5d8f29445a834590c65de587b4a0b76e81e166",
      "size_bytes": 146,
      "symbol_limit_reached": false,
      "symbols": [
        {
          "end_line": 4,
          "extractor": "lexical-v1",
          "kind": "function",
          "name": "unsafe_join",
          "qualified_name": "unsafe_join",
          "start_line": 4,
          "tokens": [
            "join",
            "unsafe"
          ]
        }
      ],
      "token_limit_reached": false,
      "tokens": {
        "apache": 1,
        "archive": 1,
        "bin": 1,
        "identifier": 1,
        "join": 1,
        "license": 1,
        "member": 2,
        "name": 2,
        "printf": 1,
        "root": 2,
        "sh": 2,
        "spdx": 1,
        "src": 1,
        "unsafe": 1
      }
    },
    {
      "content_indexed": true,
      "language": "shell",
      "line_count": 16,
      "path": "tests/reproduce.sh",
      "sha256": "sha256:f3c1d5a34df3a4f5dcfb25dcfad9b82b8fc4110090a4e2b5dcea7180af955804",
      "size_bytes": 364,
      "symbol_limit_reached": false,
      "symbols": [],
      "token_limit_reached": false,
      "tokens": {
        "apache": 1,
        "archive": 1,
        "bin": 1,
        "candidate": 2,
        "escaped": 3,
        "eu": 1,
        "exit": 2,
        "fi": 1,
        "identifier": 1,
        "if": 1,
        "join": 1,
        "license": 1,
        "lumi": 3,
        "mkdir": 1,
        "not": 1,
        "observed": 1,
        "path": 1,
        "printf": 3,
        "repo": 1,
        "reproduce": 1,
        "root": 2,
        "set": 1,
        "sh": 3,
        "spdx": 1,
        "src": 1,
        "tests": 1,
        "then": 1,
        "tmp": 3,
        "trace": 3,
        "traversal": 1,
        "txt": 2,
        "unsafe": 1,
        "witness": 2
      }
    }
  ],
  "global_limit_reached": {
    "symbols": false,
    "token_entries": false
  },
  "index_id": "index:c1f833f3a2d163b45bc94891a97d837edcf9088786c01dd762f45f834b4beb8a",
  "indexed_text_file_count": 4,
  "limits": {
    "max_index_file_records": 25000,
    "max_index_json_bytes": 62914560,
    "max_python_ast_nodes": 200000,
    "max_qualified_symbol_chars": 1024,
    "max_symbol_name_chars": 256,
    "max_symbol_tokens": 16,
    "max_symbols_per_file": 5000,
    "max_text_bytes": 2097152,
    "max_total_symbols": 10000,
    "max_total_token_entries": 100000,
    "max_unique_tokens_per_file": 50000
  },
  "repository": {
    "algorithm": "lumi-tree-sha256-v1",
    "file_count": 4,
    "manifest_id": "sha256:24e0f02418f391392143fdf102135b2d42124ab2b57a06c650771a82c2790dc1",
    "repository_id": "repository:24e0f02418f391392143fdf102135b2d42124ab2b57a06c650771a82c2790dc1",
    "source_kind": "directory",
    "total_bytes": 928
  },
  "schema_version": "repository-index-v1",
  "symbol_count": 1
}
